{
  "schemaVersion": "1.0.0",
  "lockId": "eeeeeeee-eeee-4eee-8eee-eeeeeeeeeeee",
  "storeId": "22222222-2222-4222-8222-222222222222",
  "clientId": "11111111-1111-4111-8111-111111111111",
  "jobId": "PB-20260825-0123456789",
  "deviceId": "33333333-3333-4333-8333-333333333333",
  "pid": 12345,
  "processStartedAt": "2026-08-25T08:00:00Z",
  "operation": "BUILD_SHADOW",
  "acquiredAt": "2026-08-25T08:00:00Z",
  "heartbeatAt": "2026-08-25T08:10:00Z",
  "expiresAt": "2026-08-25T08:11:00Z",
  "nonce": "QUJDREVGR0hJSktMTU5PUA"
}
